REGION,HEI_NAME,HEI_TYPE,HEI_CITY,HEI_PROVINCE,FHE_GRANTEES,SEX_M,SEX_F,NOT_INDICATED,YEAR
04 - CALABARZON,Pamantasan Ng Lungsod Ng San Pablo,LUC,CITY OF SAN PABLO,LAGUNA,4104,1886,2218,,2019-2020
04 - CALABARZON,Pambayang Kolehiyo Ng Mauban,LUC,MAUBAN,QUEZON PROVINCE,604,169,435,,2019-2020
04 - CALABARZON,San Mateo Municipal College,LUC,SAN MATEO,RIZAL PROVINCE,2803,923,1880,,2019-2020
04 - CALABARZON,Southern Luzon State University,SUC,LUCBAN,QUEZON PROVINCE,6620,2716,3904,,2019-2020
04 - CALABARZON,Tanauan City College,LUC,CITY OF TANAUAN,BATANGAS,878,430,448,,2019-2020
04 - CALABARZON,Trece Martires City College,LUC,CITY OF TRECE MARTIRES (CAPITAL),CAVITE,1276,508,768,,2019-2020
04 - CALABARZON,University Of Rizal System,SUC,TANAY,RIZAL PROVINCE,14026,5888,8138,,2019-2020
05 - Bicol Region,Aroroy Municipal College,LUC,AROROY,MASBATE,716,240,476,,2019-2020
05 - Bicol Region,Baao Community College,LUC,BAAO,CAMARINES SUR,1793,641,1150,2,2019-2020
05 - Bicol Region,Bicol State College Of Applied Sciences And Technology,SUC,CITY OF NAGA,CAMARINES SUR,2519,1222,1198,99,2019-2020
05 - Bicol Region,Bicol University,SUC,LEGAZPI CITY,ALBAY,13750,5353,8373,24,2019-2020
05 - Bicol Region,Calabanga Community College,LUC,CALABANGA,CAMARINES SUR,707,201,506,,2019-2020
05 - Bicol Region,Camarines Norte State College,SUC,DAET (CAPITAL),CAMARINES NORTE,1948,581,673,694,2019-2020
05 - Bicol Region,Camarines Sur Polytechnic College,SUC,NABUA,CAMARINES SUR,5621,2527,3094,,2019-2020
05 - Bicol Region,Caramoan Community College,LUC,CARAMOAN,CAMARINES SUR,952,332,620,,2019-2020
05 - Bicol Region,Catanduanes State University,SUC,VIRAC (CAPITAL),CATANDUANES,5781,2679,3102,,2019-2020
05 - Bicol Region,Central Bicol State University Of Agriculture,SUC,PILI (CAPITAL),CAMARINES SUR,8790,3722,5063,5,2019-2020
05 - Bicol Region,City College Of Naga,LUC,CITY OF NAGA,CAMARINES SUR,427,51,376,,2019-2020
05 - Bicol Region,Community College Of Manito,LUC,MANITO,ALBAY,576,210,366,,2019-2020
05 - Bicol Region,Daraga Community College,LUC,DARAGA,ALBAY,2773,774,1995,4,2019-2020
05 - Bicol Region,Donsol Community College,LUC,DONSOL,SORSOGON,524,217,307,,2019-2020
05 - Bicol Region,"Dr. Emilio B. Espinosa, Sr. Memorial State College Of Agriculture And Technology",SUC,MANDAON,MASBATE,4829,2237,2592,,2019-2020
05 - Bicol Region,Governor Mariano E. Villafuerte Community College,LUC,GARCHITORENA,CAMARINES SUR,733,294,439,,2019-2020
05 - Bicol Region,Libon Community College,LUC,LIBON,ALBAY,925,354,512,59,2019-2020
05 - Bicol Region,Ligao Community College,LUC,CITY OF LIGAO,ALBAY,1113,440,673,,2019-2020
05 - Bicol Region,Oas Community College,LUC,OAS,ALBAY,1684,653,1029,2,2019-2020
05 - Bicol Region,Partido State University,SUC,GOA,CAMARINES SUR,5014,2397,2614,3,2019-2020
05 - Bicol Region,Polangui Community College,LUC,POLANGUI,ALBAY,1305,457,848,,2019-2020
05 - Bicol Region,Rapu-Rapu Community College,LUC,RAPU-RAPU,ALBAY,313,151,162,,2019-2020
05 - Bicol Region,San Jose Community College,LUC,MALILIPOT,ALBAY,3528,-,-,3528,2019-2020
05 - Bicol Region,San Pascual Polytechnic College,LUC,SAN PASCUAL,MASBATE,164,53,111,,2019-2020
05 - Bicol Region,Sorsogon Community College,LUC,CITY OF SORSOGON (CAPITAL),SORSOGON,307,23,284,,2019-2020
05 - Bicol Region,Sorsogon State University,SUC,CITY OF SORSOGON (CAPITAL),SORSOGON,8730,4118,4612,,2019-2020
05 - Bicol Region,Tiwi Community College,LUC,TIWI,ALBAY,1025,397,628,,2019-2020
06 - Western Visayas,Aklan State University,SUC,BANGA,AKLAN,6515,1376,2274,2865,2019-2020
06 - Western Visayas,Bacolod City College,LUC,CITY OF BACOLOD (CAPITAL),NEGROS OCCIDENTAL,3168,905,2214,49,2019-2020
06 - Western Visayas,Bago City College,LUC,CITY OF BAGO,NEGROS OCCIDENTAL,4030,1848,2079,103,2019-2020
06 - Western Visayas,Capiz State University,SUC,CITY OF ROXAS (CAPITAL),CAPIZ,13109,5983,7105,21,2019-2020
06 - Western Visayas,Carlos Hilado Memorial State College,SUC,CITY OF TALISAY,NEGROS OCCIDENTAL,9535,4208,5327,,2019-2020
06 - Western Visayas,Central Philippine State University,SUC,CITY OF KABANKALAN,NEGROS OCCIDENTAL,8826,3882,4936,8,2019-2020
06 - Western Visayas,Guimaras State College,SUC,BUENAVISTA,GUIMARAS,3080,1508,1572,,2019-2020
06 - Western Visayas,Iloilo City Community College,LUC,CITY OF ILOILO (CAPITAL),ILOILO,480,107,373,,2019-2020
06 - Western Visayas,Iloilo Science And Technology University,SUC,CITY OF ILOILO (CAPITAL),ILOILO,11140,5220,5920,,2019-2020
06 - Western Visayas,Iloilo State College Of Fisheries,SUC,BAROTAC NUEVO,ILOILO,4228,1967,2261,,2019-2020
06 - Western Visayas,Northern Iloilo Polytechnic State College,SUC,ESTANCIA,ILOILO,8365,3923,4437,5,2019-2020
06 - Western Visayas,Northern Negros State College Of Science And Technology,SUC,CITY OF SAGAY,NEGROS OCCIDENTAL,6089,2393,3690,6,2019-2020
06 - Western Visayas,Libacao College Of Science And Technology,LUC,LIBACAO,AKLAN,165,74,91,,2019-2020
06 - Western Visayas,Passi City College,LUC,CITY OF PASSI,ILOILO,1664,755,909,,2019-2020
06 - Western Visayas,University Of Antique,SUC,SIBALOM,ANTIQUE,12359,5644,6714,1,2019-2020
06 - Western Visayas,West Visayas State University,SUC,CITY OF ILOILO (CAPITAL),ILOILO,9528,3579,5947,2,2019-2020
07 - Central Visayas,Bohol Island State University,SUC,CITY OF TAGBILARAN (CAPITAL),BOHOL,14073,6012,8060,1,2019-2020
07 - Central Visayas,Buenavista Community College,LUC,BUENAVISTA,BOHOL,1928,914,1014,,2019-2020
07 - Central Visayas,Carcar City College,LUC,CITY OF CARCAR,CEBU,1084,438,646,,2019-2020
07 - Central Visayas,Cebu Normal University,SUC,CITY OF CEBU (CAPITAL),CEBU,4815,943,3872,,2019-2020
07 - Central Visayas,Cebu Technological University,SUC,CITY OF CEBU (CAPITAL),CEBU,36673,17151,19510,12,2019-2020
07 - Central Visayas,Consolacion Community College,LUC,CONSOLACION,CEBU,1253,407,846,,2019-2020
07 - Central Visayas,Cordova Public College,LUC,CORDOVA,CEBU,1759,618,1141,,2019-2020
07 - Central Visayas,Lapu-Lapu City College,LUC,CITY OF LAPU-LAPU (OPON),CEBU,1045,323,722,,2019-2020
07 - Central Visayas,Madridejos Community College,LUC,MADRIDEJOS,CEBU,1595,550,1025,20,2019-2020
07 - Central Visayas,Mandaue City College,LUC,CITY OF MANDAUE,CEBU,1232,426,805,1,2019-2020
07 - Central Visayas,Negros Oriental State University,SUC,CITY OF DUMAGUETE (CAPITAL),NEGROS ORIENTAL,24933,11079,13839,15,2019-2020
07 - Central Visayas,Sibonga Community College,LUC,SIBONGA,CEBU,953,373,580,,2019-2020
07 - Central Visayas,Siquijor State College,SUC,LARENA,SIQUIJOR,1738,872,866,,2019-2020
07 - Central Visayas,Talibon Polytechnic College,LUC,TALIBON,BOHOL,586,308,278,,2019-2020
07 - Central Visayas,Talisay City College,LUC,CITY OF TALISAY,CEBU,3942,1459,2483,,2019-2020
07 - Central Visayas,Trinidad Municipal College,LUC,TRINIDAD,BOHOL,4058,1766,2292,,2019-2020
08 - Eastern Visayas,Abuyog Community College,LUC,ABUYOG,LEYTE,2014,944,1070,,2019-2020
08 - Eastern Visayas,Biliran Province State University,SUC,NAVAL (CAPITAL),BILIRAN,6774,3304,3449,21,2019-2020
08 - Eastern Visayas,Burauen Community College,LUC,BURAUEN,LEYTE,546,346,200,,2019-2020
08 - Eastern Visayas,Colegio De Las Navas,LUC,LAS NAVAS,NORTHERN SAMAR,455,200,255,,2019-2020
08 - Eastern Visayas,Eastern Samar State University,SUC,CITY OF BORONGAN (CAPITAL),EASTERN SAMAR,12665,5958,6701,6,2019-2020
08 - Eastern Visayas,Eastern Visayas State University,SUC,CITY OF TACLOBAN (CAPITAL),LEYTE,17543,8031,9476,36,2019-2020
08 - Eastern Visayas,Leyte Normal University,SUC,CITY OF TACLOBAN (CAPITAL),LEYTE,5987,-,-,5987,2019-2020
08 - Eastern Visayas,Maasin City College,LUC,CITY OF MAASIN,SOUTHERN LEYTE,965,295,667,3,2019-2020
08 - Eastern Visayas,Northwest Samar State University,SUC,CITY OF CALBAYOG,WESTERN SAMAR,5256,2485,2771,,2019-2020
08 - Eastern Visayas,Palompon Institute Of Technology,SUC,PALOMPON,LEYTE,4462,2785,1677,,2019-2020
08 - Eastern Visayas,Samar State University,SUC,CITY OF CATBALOGAN (CAPITAL),WESTERN SAMAR,6337,2754,3583,,2019-2020
08 - Eastern Visayas,Southern Leyte State University,SUC,SOGOD,SOUTHERN LEYTE,9095,4369,4726,,2019-2020
08 - Eastern Visayas,University Of Eastern Philippines,SUC,CATARMAN (CAPITAL),NORTHERN SAMAR,12109,5490,6617,2,2019-2020
08 - Eastern Visayas,Visayas State University,SUC,CITY OF BAYBAY,LEYTE,11716,4652,7062,2,2019-2020
09 - Zamboanga Peninsula,Jose Rizal Memorial State University,SUC,CITY OF DAPITAN,ZAMBOANGA DEL NORTE,15746,7276,8470,,2019-2020
09 - Zamboanga Peninsula,Josefina H. Cerilles State College,SUC,SAN MIGUEL,ZAMBOANGA DEL SUR,9391,-,-,9391,2019-2020
09 - Zamboanga Peninsula,Western Mindanao State University,SUC,CITY OF ZAMBOANGA,ZAMBOANGA DEL SUR,15968,6509,9459,,2019-2020
09 - Zamboanga Peninsula,Zamboanga Del Sur Provincial Government College,LUC,AURORA,ZAMBOANGA DEL SUR,1426,-,-,1426,2019-2020
09 - Zamboanga Peninsula,Zamboanga Peninsula Polytechnic State University,SUC,CITY OF ZAMBOANGA,ZAMBOANGA DEL SUR,8390,4427,3963,,2019-2020
09 - Zamboanga Peninsula,Zamboanga State College Of Marine Sciences And Technology,SUC,CITY OF ZAMBOANGA,ZAMBOANGA DEL SUR,3863,1931,1932,,2019-2020
10 - Northern Mindanao,Bukidnon State University,SUC,CITY OF MALAYBALAY (CAPITAL),BUKIDNON,13608,5241,8367,,2019-2020
10 - Northern Mindanao,Camiguin Polytechnic State College,SUC,MAMBAJAO (CAPITAL),CAMIGUIN,2150,984,1166,,2019-2020
10 - Northern Mindanao,Central Mindanao University,SUC,MARAMAG,BUKIDNON,10457,3677,6780,,2019-2020
10 - Northern Mindanao,City College Of El Salvador,LUC,CITY OF EL SALVADOR,MISAMIS ORIENTAL,755,316,438,1,2019-2020
10 - Northern Mindanao,Community College Of Gingoog City,LUC,GINGOOG CITY,MISAMIS ORIENTAL,683,296,385,2,2019-2020
10 - Northern Mindanao,Don Carlos Polytechnic College,LUC,DON CARLOS,BUKIDNON,1077,468,609,,2019-2020
10 - Northern Mindanao,Gov. Alfonso D. Tan College,LUC,CITY OF TANGUB,MISAMIS OCCIDENTAL,2868,1204,1664,,2019-2020
10 - Northern Mindanao,Initao College,LUC,INITAO,MISAMIS ORIENTAL,1596,709,887,,2019-2020
10 - Northern Mindanao,Magsaysay College,LUC,MAGSAYSAY,MISAMIS ORIENTAL,508,218,290,,2019-2020
10 - Northern Mindanao,Mindanao State University - Iligan Institute Of Technology,SUC,CITY OF ILIGAN,LANAO DEL NORTE,7255,-,-,7255,2019-2020
10 - Northern Mindanao,Northern Bukidnon State College,SUC,MANOLO FORTICH,BUKIDNON,1565,572,953,40,2019-2020
10 - Northern Mindanao,Northwestern Mindanao State College Of Science And Technology,SUC,CITY OF TANGUB,MISAMIS OCCIDENTAL,3416,1662,1754,,2019-2020
10 - Northern Mindanao,Opol Community College,LUC,OPOL,MISAMIS ORIENTAL,1986,814,1172,,2019-2020
10 - Northern Mindanao,Pangantucan Bukidnon Community College,LUC,PANGANTUCAN,BUKIDNON,621,267,354,,2019-2020
10 - Northern Mindanao,Salay Community College,LUC,SALAY,MISAMIS ORIENTAL,474,178,296,,2019-2020
10 - Northern Mindanao,Tagoloan Community College,LUC,TAGOLOAN,MISAMIS ORIENTAL,5360,2340,3020,,2019-2020
10 - Northern Mindanao,Tubod College,LUC,TUBOD,LANAO DEL NORTE,496,187,309,,2019-2020
10 - Northern Mindanao,University Of Science And Technology Of Southern Philippines,SUC,CITY OF CAGAYAN DE ORO (CAPITAL),MISAMIS ORIENTAL,12073,6218,5855,,2019-2020
11 - Davao Region,Davao De Oro State College,SUC,COMPOSTELA,DAVAO DE ORO,2196,942,1252,2,2019-2020
11 - Davao Region,Davao Del Norte State College,SUC,CITY OF PANABO,DAVAO DEL NORTE,3243,1346,1897,,2019-2020
11 - Davao Region,Davao Oriental State University,SUC,CITY OF MATI (CAPITAL),DAVAO ORIENTAL,7590,3053,4263,274,2019-2020
11 - Davao Region,"Governor Generoso College Of Arts, Science And Technology",LUC,GOVERNOR GENEROSO,DAVAO ORIENTAL,896,364,532,,2019-2020
11 - Davao Region,"Kapalong College Of Agriculture, Sciences And Technology",LUC,KAPALONG,DAVAO DEL NORTE,2584,1061,1518,5,2019-2020
11 - Davao Region,Kolehiyo Ng Pantukan,LUC,PANTUKAN,COMPOSTELA VALLEY,1511,649,862,,2019-2020
11 - Davao Region,"Monkayo College Of Arts, Sciences And Technology",LUC,MONKAYO,COMPOSTELA VALLEY,1812,710,1102,,2019-2020
11 - Davao Region,"Santo Tomas College Of Agriculture, Sciences And Technology",LUC,SANTO TOMAS,DAVAO DEL NORTE,1238,517,721,,2019-2020
11 - Davao Region,"Southern Philippines Agri-Business, Marine And Aquatic School Of Technology",SUC,MALITA,DAVAO DEL SUR,5032,2161,2869,2,2019-2020
11 - Davao Region,University Of Southeastern Philippines,SUC,CITY OF DAVAO,DAVAO DEL SUR,6223,2773,3449,1,2019-2020
12 - Soccsksargen,Cotabato Foundation College Of Science And Technology,SUC,ARAKAN,NORTH COTABATO,3440,1479,1961,,2019-2020
12 - Soccsksargen,Cotabato State University,SUC,CITY OF COTABATO,COTABATO CITY,4444,2092,2352,,2019-2020
12 - Soccsksargen,Glan Institute Of Technology,LUC,GLAN,SARANGANI,1019,498,521,,2019-2020
12 - Soccsksargen,Makilala Institute Of Science And Technology,LUC,MAKILALA,NORTH COTABATO,2493,1121,1372,,2019-2020
12 - Soccsksargen,Sultan Kudarat State University,SUC,CITY OF TACURONG,SULTAN KUDARAT,6448,2580,3868,,2019-2020
12 - Soccsksargen,University Of Southern Mindanao-Main,SUC,KABACAN,NORTH COTABATO,12458,5601,6857,,2019-2020
13 - NCR,City Of Malabon University,LUC,CITY OF MALABON,METRO MANILA,4500,1914,2586,,2019-2020
13 - NCR,Dr. Filemon C. Aguilar Memorial College Of Las Piñas,LUC,CITY OF LAS PIÑAS,METRO MANILA,2070,760,1306,4,2019-2020
13 - NCR,"Eulogio ""Amang"" Rodriguez Institute Of Science And Technology",SUC,SAMPALOC,METRO MANILA,14924,7288,7636,,2019-2020
13 - NCR,Marikina Polytechnic College,SUC,CITY OF MARIKINA,METRO MANILA,4297,2467,1830,,2019-2020
13 - NCR,Navotas Polytechnic College,LUC,CITY OF NAVOTAS,METRO MANILA,2458,937,1521,,2019-2020
13 - NCR,Pamantasan Ng Lungsod Ng Maynila,LUC,INTRAMUROS,METRO MANILA,6697,2375,4322,,2019-2020
13 - NCR,Pamantasan Ng Lungsod Ng Muntinlupa,LUC,CITY OF MUNTINLUPA,METRO MANILA,9072,4286,4786,,2019-2020
13 - NCR,Pamantasan Ng Lungsod Ng Pasig,LUC,CITY OF PASIG,METRO MANILA,2334,847,1487,,2019-2020
13 - NCR,Pateros Technological College,LUC,PATEROS,METRO MANILA,778,402,371,5,2019-2020
13 - NCR,Philippine Normal University,SUC,ERMITA,METRO MANILA,3620,955,2665,-,2019-2020
13 - NCR,Philippine State College Of Aeronautics,SUC,PASAY CITY,METRO MANILA,8297,6026,2226,45,2019-2020
13 - NCR,Polytechnic University Of The Philippines,SUC,SAMPALOC,METRO MANILA,49085,20381,28704,-,2019-2020
13 - NCR,Rizal Technological University,SUC,CITY OF MANDALUYONG,METRO MANILA,22056,9335,12721,,2019-2020
13 - NCR,Taguig City University,LUC,TAGUIG CITY,METRO MANILA,7323,3308,4013,2,2019-2020
13 - NCR,Technological University Of The Philippines,SUC,ERMITA,METRO MANILA,15297,9367,5930,,2019-2020
13 - NCR,University Of The Philippines,SUC,QUEZON CITY,METRO MANILA,27986,11784,16202,,2019-2020
13 - NCR,Valenzuela City Polytechnic College,LUC,CITY OF VALENZUELA,METRO MANILA,1297,0,0,1297,2019-2020
14 - CAR,Abra State Institute Of Science And Technology,SUC,LANGAGILANG,ABRA,3529,467,489,2573,2019-2020
14 - CAR,Apayao State College,SUC,CONNER,APAYAO,2696,-,-,2696,2019-2020
14 - CAR,Benguet State University,SUC,LA TRINIDAD,BENGUET,5674,1743,3931,,2019-2020
14 - CAR,Ifugao State University,SUC,LAMUT,IFUGAO,5023,2309,2714,,2019-2020
14 - CAR,Kalinga State University,SUC,TABUK CITY,KALINGA,4698,1966,2732,,2019-2020
14 - CAR,Mountain Province State Polytechnic College,SUC,BONTOC,MOUNTAIN PROVINCE,3651,1713,1937,1,2019-2020
15 - BARMM,Adiong Memorial Polytechnic State College,SUC,DITSAAN-RAMAIN,LANAO DEL SUR,845,292,553,,2019-2020
15 - BARMM,Basilan State College,SUC,CITY OF LAMITAN (CAPITAL),BASILAN,4828,-,-,4828,2019-2020
15 - BARMM,Mindanao State University-Tawi-Tawi College Of Technology And Oceanography,SUC,BONGAO (CAPITAL),TAWI-TAWI,1675,672,1003,,2019-2020
15 - BARMM,Sulu State College,SUC,JOLO (CAPITAL),SULU PROVINCE,3707,310,540,2857,2019-2020
15 - BARMM,Tawi-Tawi Regional Agricultural College,SUC,BONGAO (CAPITAL),TAWI-TAWI,2214,1055,1159,,2019-2020
15 - BARMM,Mindanao State University,SUC,CITY OF MARAWI (CAPITAL),LANAO DEL SUR,23498,-,-,23498,2019-2020
16 - Caraga,Agusan Del Sur State College Of Agriculture And Technology,SUC,BUNAWAN,AGUSAN DEL SUR,5784,2202,3582,,2019-2020
16 - Caraga,Caraga State University,SUC,CITY OF BUTUAN (CAPITAL),AGUSAN DEL NORTE,7895,-,-,7895,2019-2020
16 - Caraga,Hinatuan Southern College,LUC,HINATUAN,SURIGAO DEL SUR,900,376,522,2,2019-2020
16 - Caraga,North Eastern Mindanao State University (Sdssu),SUC,CITY OF TANDAG (CAPITAL),SURIGAO DEL SUR,13191,6136,7052,3,2019-2020
16 - Caraga,Surigao State College Of Technology,SUC,CITY OF SURIGAO (CAPITAL),SURIGAO DEL NORTE,9515,5130,4383,2,2019-2020
17 - MIMAROPA,Baco Community College,LUC,BACO,ORIENTAL MINDORO,245,87,158,,2019-2020
17 - MIMAROPA,City College Of Calapan,LUC,CITY OF CALAPAN (CAPITAL),ORIENTAL MINDORO,856,287,569,,2019-2020
17 - MIMAROPA,Marinduque State College,SUC,BOAC (CAPITAL),MARINDUQUE,5035,2327,2708,,2019-2020
17 - MIMAROPA,Mindoro State University,SUC,VICTORIA,ORIENTAL MINDORO,7263,3084,4178,1,2019-2020
17 - MIMAROPA,Occidental Mindoro State College,SUC,SAN JOSE,OCCIDENTAL MINDORO,10131,4229,5826,76,2019-2020
17 - MIMAROPA,Palawan State University,SUC,CITY OF PUERTO PRINCESA (CAPITAL),PALAWAN,16842,5990,8937,1915,2019-2020
17 - MIMAROPA,Romblon State University,SUC,ODIONGAN,ROMBLON,9860,4624,5236,,2019-2020
17 - MIMAROPA,Western Philippines University,SUC,ABORLAN,PALAWAN,8659,-,-,8659,2019-2020
01 - Ilocos Region,Binalatongan Community College,LUC,SAN CARLOS CITY,PANGASINAN,1641,533,1108,,2020-2021
01 - Ilocos Region,Don Mariano Marcos Memorial State University,SUC,SAN FERNANDO CITY,LA UNION,14837,6300,8537,,2020-2021
01 - Ilocos Region,Ilocos Sur Community College,LUC,VIGAN CITY,ILOCOS SUR,1565,684,881,,2020-2021
01 - Ilocos Region,Ilocos Sur Polytechnic State College,SUC,SANTA MARIA,ILOCOS SUR,5711,2575,3136,,2020-2021
01 - Ilocos Region,Mariano Marcos State University,SUC,BATAC CITY,ILOCOS NORTE,10957,4441,6516,,2020-2021
01 - Ilocos Region,North Luzon Philippines State College,SUC,CANDON CITY,ILOCOS SUR,3507,1592,1915,,2020-2021
01 - Ilocos Region,Pangasinan State University,SUC,LINGAYEN,PANGASINAN,22866,9792,13074,,2020-2021
01 - Ilocos Region,University Of Eastern Pangasinan,LUC,BINALONAN,PANGASINAN,3364,1392,1972,,2020-2021
01 - Ilocos Region,University Of Northern Philippines,SUC,VIGAN CITY,ILOCOS SUR,11951,5166,6785,,2020-2021
01 - Ilocos Region,Urdaneta City University,LUC,URDANETA CITY,PANGASINAN,11277,4743,6534,,2020-2021
02 - Cagayan Valley,Batanes State College,SUC,BASCO,BATANES,579,305,274,,2020-2021
02 - Cagayan Valley,Cagayan State University,SUC,TUGUEGARAO CITY,CAGAYAN,24171,9646,14525,,2020-2021
02 - Cagayan Valley,Isabela State University,SUC,ECHAGUE,ISABELA,30872,13380,17492,,2020-2021
02 - Cagayan Valley,Nueva Vizcaya State University,SUC,BAYOMBONG,NUEVA VIZCAYA,11043,4583,6460,,2020-2021
02 - Cagayan Valley,Quirino State University,SUC,DIFFUN,QUIRINO PROVINCE,5062,2311,2751,,2020-2021
03 - Central Luzon,Aurora State College Of Technology,SUC,BALER,AURORA,4542,2181,2361,,2020-2021
03 - Central Luzon,Baliwag Polytechnic College,LUC,BALIUAG,BULACAN,4191,1623,2568,,2020-2021
03 - Central Luzon,Bataan Peninsula State University,SUC,CITY OF BALANGA (CAPITAL),BATAAN,11764,5170,6594,,2020-2021
03 - Central Luzon,Bulacan Agricultural State College,SUC,SAN ILDEFONSO,BULACAN,4989,1411,1582,1996.0,2020-2021
03 - Central Luzon,Bulacan Polytechnic College,LUC,CITY OF MALOLOS (CAPITAL),BULACAN,1822,700,1122,,2020-2021
03 - Central Luzon,Bulacan State University,SUC,CITY OF MALOLOS (CAPITAL),BULACAN,37227,16615,20612,,2020-2021
03 - Central Luzon,Central Luzon State University,SUC,SCIENCE CITY OF MUÑOZ,NUEVA ECIJA,10922,4326,6596,,2020-2021
03 - Central Luzon,City College Of Angeles,LUC,CITY OF ANGELES,PAMPANGA,3334,1395,1937,2.0,2020-2021
03 - Central Luzon,City College Of San Fernando,LUC,CITY OF SAN FERNANDO (CAPITAL),PAMPANGA,660,203,457,0.0,2020-2021
03 - Central Luzon,Don Honorio Ventura Technological State University,SUC,BACOLOR,PAMPANGA,28207,13462,14745,,2020-2021
03 - Central Luzon,Eduardo L. Joson Memorial College,LUC,CITY OF PALAYAN (CAPITAL),NUEVA ECIJA,920,207,713,,2020-2021
03 - Central Luzon,Gordon College,LUC,CITY OF OLONGAPO,ZAMBALES,5155,1975,3180,,2020-2021
03 - Central Luzon,Guagua Community College,LUC,GUAGUA,PAMPANGA,493,191,302,,2020-2021
03 - Central Luzon,Kolehiyo Ng Subic,LUC,CITY OF OLONGAPO,ZAMBALES,3196,1284,1912,,2020-2021
03 - Central Luzon,Mabalacat City College,LUC,MABALACAT CITY,PAMPANGA,3199,1314,1885,,2020-2021
03 - Central Luzon,Norzagaray College,LUC,NORZAGARAY,BULACAN,943,381,562,,2020-2021
03 - Central Luzon,Nueva Ecija University Of Science And Technology,SUC,CITY OF CABANATUAN,NUEVA ECIJA,21454,9872,11582,,2020-2021
03 - Central Luzon,Pambayang Dalubhasaan Ng Marilao,LUC,MARILAO,BULACAN,1629,708,921,,2020-2021
03 - Central Luzon,Pampanga State Agricultural University,SUC,MAGALANG,PAMPANGA,5475,2547,2928,,2020-2021
03 - Central Luzon,Philippine Merchant Marine Academy,SUC,SAN NARCISO,ZAMBALES,916,848,68,,2020-2021
03 - Central Luzon,Polytechnic College Of Botolan,LUC,BOTOLAN,ZAMBALES,707,289,418,,2020-2021
03 - Central Luzon,Polytechnic College Of The City Of Meycauayan,LUC,CITY OF MEYCAUAYAN,BULACAN,1069,361,708,,2020-2021
03 - Central Luzon,President Ramon Magsaysay State University,SUC,IBA (CAPITAL),ZAMBALES,10448,4851,5597,,2020-2021
03 - Central Luzon,Tarlac Agricultural University,SUC,CAMILING,TARLAC,5070,2193,2877,,2020-2021
03 - Central Luzon,Tarlac State University,SUC,CITY OF TARLAC (CAPITAL),TARLAC,17877,7813,10064,,2020-2021
04 - CALABARZON,Antipolo Institute Of Technology (Aitech),LUC,CITY OF ANTIPOLO (CAPITAL),RIZAL PROVINCE,298,167,131,,2020-2021
04 - CALABARZON,Balian Community College,LUC,PANGIL,LAGUNA,528,126,402,,2020-2021
04 - CALABARZON,Batangas State University,SUC,BATANGAS CITY (CAPITAL),BATANGAS,36040,14622,21418,,2020-2021
04 - CALABARZON,Cavite State University,SUC,INDANG,CAVITE,47802,19972,27830,,2020-2021
04 - CALABARZON,City College Of Calamba,LUC,CITY OF CALAMBA,LAGUNA,2556,903,1653,0.0,2020-2021
04 - CALABARZON,City College Of Tagaytay,LUC,CITY OF TAGAYTAY,CAVITE,3028,1285,1743,0.0,2020-2021
04 - CALABARZON,Colegio De Montalban,LUC,RODRIGUEZ (MONTALBAN),RIZAL PROVINCE,4471,2380,2084,7.0,2020-2021
04 - CALABARZON,Colegio Ng Lungsod Ng Batangas,LUC,BATANGAS CITY (CAPITAL),BATANGAS,850,174,676,0.0,2020-2021
04 - CALABARZON,Dalubhasaan Ng Lungsod Ng Lucena,LUC,CITY OF LUCENA (CAPITAL),QUEZON PROVINCE,2463,941,1522,0.0,2020-2021
04 - CALABARZON,Kolehiyo Ng Lungsod Ng Lipa,LUC,LIPA CITY,BATANGAS,6431,3354,3077,,2020-2021
04 - CALABARZON,Laguna State Polytechnic University,SUC,SANTA CRUZ (CAPITAL),LAGUNA,23983,10717,13265,1.0,2020-2021
04 - CALABARZON,Laguna University,LUC,SANTA CRUZ (CAPITAL),LAGUNA,4594,1917,2677,,2020-2021
04 - CALABARZON,One Cainta College,LUC,CAINTA,RIZAL PROVINCE,1011,423,588,,2020-2021
04 - CALABARZON,Pamantasan Ng Cabuyao,LUC,CITY OF CABUYAO,LAGUNA,4613,1781,2832,,2020-2021
04 - CALABARZON,Pamantasan Ng Lungsod Ng San Pablo,LUC,CITY OF SAN PABLO,LAGUNA,5115,2035,2866,214.0,2020-2021
04 - CALABARZON,Pambayang Kolehiyo Ng Mauban,LUC,MAUBAN,QUEZON PROVINCE,755,210,545,,2020-2021
04 - CALABARZON,San Mateo Municipal College,LUC,SAN MATEO,RIZAL PROVINCE,3421,1055,2366,,2020-2021
04 - CALABARZON,Southern Luzon State University,SUC,LUCBAN,QUEZON PROVINCE,8115,3005,5110,,2020-2021
04 - CALABARZON,Tanauan City College,LUC,CITY OF TANAUAN,BATANGAS,995,450,545,,2020-2021
04 - CALABARZON,Trece Martires City College,LUC,CITY OF TRECE MARTIRES (CAPITAL),CAVITE,1408,540,868,,2020-2021
04 - CALABARZON,University Of Rizal System,SUC,TANAY,RIZAL PROVINCE,15923,6533,9384,6.0,2020-2021
05 - Bicol Region,Aroroy Municipal College,LUC,AROROY,MASBATE,923,306,617,,2020-2021
05 - Bicol Region,Baao Community College,LUC,BAAO,CAMARINES SUR,2475,803,1672,,2020-2021
05 - Bicol Region,Bicol State College Of Applied Sciences And Technology,SUC,CITY OF NAGA,CAMARINES SUR,3375,1679,1694,2.0,2020-2021
05 - Bicol Region,Bicol University,SUC,LEGAZPI CITY,ALBAY,19861,7439,12419,3.0,2020-2021
05 - Bicol Region,Calabanga Community College,LUC,CALABANGA,CAMARINES SUR,1077,304,773,,2020-2021
05 - Bicol Region,Camarines Norte State College,SUC,DAET (CAPITAL),CAMARINES NORTE,7450,2639,3801,1010.0,2020-2021
05 - Bicol Region,Camarines Sur Polytechnic College,SUC,NABUA,CAMARINES SUR,6975,3012,3963,0.0,2020-2021
05 - Bicol Region,Caramoan Community College,LUC,CARAMOAN,CAMARINES SUR,1250,451,799,,2020-2021
05 - Bicol Region,Catanduanes State University,SUC,VIRAC (CAPITAL),CATANDUANES,8791,3875,4916,,2020-2021
05 - Bicol Region,Central Bicol State University Of Agriculture,SUC,PILI (CAPITAL),CAMARINES SUR,9928,4038,5890,,2020-2021
05 - Bicol Region,City College Of Naga,LUC,CITY OF NAGA,CAMARINES SUR,284,34,250,,2020-2021
05 - Bicol Region,Community College Of Manito,LUC,MANITO,ALBAY,643,229,414,,2020-2021
05 - Bicol Region,Daraga Community College,LUC,DARAGA,ALBAY,5300,1882,3415,3.0,2020-2021
05 - Bicol Region,Donsol Community College,LUC,DONSOL,SORSOGON,701,297,404,0.0,2020-2021
05 - Bicol Region,"Dr. Emilio B. Espinosa, Sr. Memorial State College Of Agriculture And Technology",SUC,MANDAON,MASBATE,5592,2515,3077,,2020-2021
05 - Bicol Region,Governor Mariano E. Villafuerte Community College,LUC,GARCHITORENA,CAMARINES SUR,1020,382,638,0.0,2020-2021
05 - Bicol Region,Libon Community College,LUC,LIBON,ALBAY,1350,542,808,0.0,2020-2021
05 - Bicol Region,Ligao Community College,LUC,CITY OF LIGAO,ALBAY,1206,443,762,1.0,2020-2021
05 - Bicol Region,Oas Community College,LUC,OAS,ALBAY,2061,793,1267,1.0,2020-2021
05 - Bicol Region,Partido State University,SUC,GOA,CAMARINES SUR,5630,2375,3255,,2020-2021
05 - Bicol Region,Polangui Community College,LUC,POLANGUI,ALBAY,1663,602,1061,0.0,2020-2021
05 - Bicol Region,Rapu-Rapu Community College,LUC,RAPU-RAPU,ALBAY,403,189,214,0.0,2020-2021
